brand,title,description,featured,active,image,sizes,colors,cost,profit
Ruine,Pensée moins inspirer image mort foule.,"Point mensonge envelopper ah dame.
Réussir seul pourtant journal acheter non voisin. L'Un maître rire le. Douter cela marche ailleurs nul joli.",f,t,static/productImg/DAFITI-SHOES-Tênis-DAFITI-SHOES-Cetim-Bege-1127-0765413-1-zoom.jpg,{38},"{#7E6AE3,#A5D6D8}",259.30,22
Troisième,Étranger être course dépasser.,Tuer phrase ciel bien pierre fruit. Digne école confiance contenter occuper. Fleur ramasser muet retourner.,f,t,static/productImg/DAFITI-SHOES-Bota-Flatform-DAFITI-SHOES-Verniz-Rosa-8943-1763103-1-zoom.jpg,"{44,40,44,37,43,38}","{#4712D4,#6985C3,#DFD158}",173.16,21
Long,Soin étendre ciel semaine.,"Commencement dire santé sous.
Passé mariage recherche ami tantôt. Demande grave maintenant moyen.",f,t,static/productImg/DAFITI-SHOES-Sandália-DAFITI-SHOES-Adriana-Preta-5048-7748071-1-zoom.jpg,"{37,39,42,37,40}","{#90C91C,#E256AE,#D36750,#5DA345}",378.20,40
Meilleur,Déclarer coucher dent exister herbe verser effort.,Digne absolument moi nez vision combien debout. Façon dangereux présenter étonner.,f,t,static/productImg/DAFITI-SHOES-Rasteira-DAFITI-SHOES-Strass-Preta-9509-3590433-1-zoom.jpg,"{45,36,41,46,45,37,45,37}","{#91D859,#60A8CE}",437.17,48
Respecter,Travail reposer toucher quant à.,Présent mot dégager payer. Étoile ah époque inquiétude cent. Seul interrompre aucun colère plus fumée.,f,t,static/productImg/DAFITI-SHOES-Rasteira-DAFITI-SHOES-Veludo-Color-Bege-4256-7856713-1-zoom.jpg,"{38,38,36,36,44,36,38}","{#0D667E,#3614B4,#201721,#FFA7FA}",75.51,10
Creuser,Lier égal pouvoir exemple ligne.,"Signifier liberté odeur hier puis cour on. Y impression ce marché toute.
Livre bande pauvre fort main fatigue. Homme exprimer lit revenir tâche précéder oeil. Saluer partout vendre énergie supposer.",f,t,static/productImg/DAFITI-SHOES-Tênis-DAFITI-SHOES-Cano-Baixo-Preto-7095-1344632-1-zoom.jpg,"{37,44,40}","{#B2844C,#BB575A,#F87808}",63.94,6
Ancien,Habiller habitant tendre attendre sein déjà scène.,"Cela en hôtel haut plaine pourquoi haïr. Naître cinquante ajouter lumière fer. Hiver étage compte.
Semblable passer beau poète face palais couche. Inviter état reconnaître.",f,t,static/productImg/DAFITI-SHOES-Bota-DAFITI-SHOES-Corrente-Preta-3484-5771282-1-zoom.jpg,"{44,46,40,36}","{#E8F09B,#8CCBE8,#7D82C9}",152.06,38
Fait,Article livrer près queue haut théâtre cela.,"Plein nu clef simplement. Accord maître circonstance article terme réunir.
Corps intérêt action voyager garder. Abri prouver trembler souhaiter particulier sac.",f,t,static/productImg/DAFITI-SHOES-Tênis-DAFITI-SHOES-Cetim-Branco-9843-4810123-1-zoom.jpg,"{46,36,39,42}","{#507D3D,#923AEA}",341.18,28
Terme,Retomber plaine spectacle troubler tout.,"Renverser tache deviner creuser. Expliquer joue approcher remettre émotion double chez eaux.
Petit avance effort paraître alors précipiter promener. Secret heureux prétendre rond.",f,t,static/productImg/DAFITI-SHOES-Tênis-DAFITI-SHOES-Cetim-Bege-1127-0765413-1-zoom.jpg,"{41,40,39,36}","{#C1E1BF,#E6481D,#A0A488,#BC2E8E}",173.80,21
Fleur,Déjà douleur battre subir.,Dehors point allumer ensuite vaste roi. Parcourir sens vouloir calme. Tout exprimer mort fixe chair. Coucher exprimer plein étude.,f,t,static/productImg/DAFITI-SHOES-Tênis-DAFITI-SHOES-Pesponto-Bege-9133-4991692-1-zoom.jpg,"{42,43}","{#F699EC,#0388A7,#83AFDD,#85BD66}",297.38,2
Franc,Lit tombe effacer passer et.,Problème fête ministre entrer précieux effort malade. Chair installer vivant expérience pendre entre entrer. Deviner instinct rester étrange couvrir pierre te.,f,t,static/productImg/DAFITI-SHOES-Slip-On-DAFITI-SHOES-Perfuros-Preto-7100-4344632-1-zoom.jpg,"{42,39,39,36,38}",{#B9AE67},278.32,11
Compte,Histoire usage retourner allumer résistance conseil facile miser.,Distinguer trente endroit autour fermer. Sembler service ressembler vêtir plaisir choix visible. Nuage briser tant forêt aider coup officier.,f,t,static/productImg/DAFITI-SHOES-Sandália-DAFITI-SHOES-Meia-Pata-Salto-Grosso-Preta-5696-9926962-1-zoom.jpg,{43},"{#FA2773,#663F18,#4305EF}",320.85,34
Intention,Avec queue faveur passion ministre trois répandre ville.,Parent muet après bureau depuis divers arme. Attendre soleil note. Sable ciel cela double tromper supérieur.,f,t,static/productImg/DAFITI-SHOES-Bota-Coturno-DAFITI-SHOES-Tachas-Preta-5010-6072403-1-zoom.jpg,"{45,46,42,42,36,39,38}","{#FAC0D2,#AF3CFF}",289.59,16
Existence,Courant indiquer oiseau pousser autrefois ce chez.,"Point sueur courage paysage. Événement le contenir.
Retourner condamner consulter honte. Asseoir espoir ville arme sourire. Aide tendre père partie auquel adresser.",f,t,static/productImg/DAFITI-SHOES-Sandália-DAFITI-SHOES-Color-Marrom-6099-9518713-1-zoom.jpg,"{36,39,43,46,38,40,43}",{#EFF689},204.24,36
Séparer,Inutile jambe forcer consulter regarder facile début appartement.,"Long rejeter annoncer. Haut monsieur visite comme étaler.
Retenir voilà ventre poste. Appel page oeuvre entourer.",f,t,static/productImg/DAFITI-SHOES-Sandália-DAFITI-SHOES-Cetim-Nó-Preta-0141-7808713-1-zoom.jpg,"{46,43}","{#9C12BD,#11DDB1,#9071F5}",388.71,23
Elle,Déjà entrer doucement système.,Projet quant à face avance. Paix apporter agent main. Résoudre poursuivre rapporter.,f,t,static/productImg/DAFITI-SHOES-Tênis-DAFITI-SHOES-Glitter-Preto-1793-2519892-1-zoom.jpg,"{36,37,39,37,42,39,46,46}","{#2D76E5,#E9C92D,#EDE032,#3038EC}",54.70,8
Refuser,Silencieux agiter disparaître vite notre masse réduire agiter.,"Retourner loin matière cas parce que engager.
Morceau crise engager lien tellement. Compagnon chose celui nul tête coin. Vide source agir abri puissant armer composer.",f,t,static/productImg/DAFITI-SHOES-Bota-DAFITI-SHOES-Fivela-Preta-2292-9376754-1-zoom.jpg,"{38,42,37,45,36,41,39,40}","{#A9F018,#C8CCC0,#54E857,#CFFB7F}",184.68,40
Loup,Désert vaste montagne ne table.,Barbe se erreur accompagner être. Secrétaire face humide arrivée public ami tracer.,f,t,static/productImg/DAFITI-SHOES-Sandália-DAFITI-SHOES-Meia-Pata-Salto-Grosso-Preta-5696-9926962-1-zoom.jpg,"{40,45}","{#963177,#F505AA,#67F141,#937D10}",222.34,10
Poids,Choix entrer emmener tout savoir demande nom.,"Ordre éclairer supporter réflexion intérieur.
Notre puis vers anglais un saint. Étaler tracer creuser effort.",f,t,static/productImg/DAFITI-SHOES-Tênis-DAFITI-SHOES-Metalizado-Glitter-Prata-4698-6865952-1-zoom.jpg,{46},"{#03D267,#E69FF3}",141.43,48
Voici,Cause bien entraîner or trente long.,"Rassurer étroit autrefois forêt garçon fleur. Afin De passage engager cas que. Exister dépasser puissant rassurer.
Quant À vert manger que. Entre oncle baisser éclat. Gauche chemise au.",f,t,static/productImg/DAFITI-SHOES-Tênis-DAFITI-SHOES-Glitter-Preto-3469-8283403-1-zoom.jpg,"{40,43,42,46}","{#E5BD40,#308446,#52EDD5,#620256}",274.53,27
Oeuvre,Sous ceci devoir leur continuer.,"Sang rue lit calme. Vers aller aile remercier côte.
Accord rue expérience parent titre. Aucun sûr chez centre.
Existence peser cas. Présenter vers aller fine parmi neuf.",f,t,static/productImg/DAFITI-SHOES-Bota-DAFITI-SHOES-Recorte-Caramelo-0309-1456103-1-zoom.jpg,"{45,36}","{#CACC32,#0F7C26,#723896}",72.21,46
Visage,Agir avec contenir faim joue rire.,"Terreur échapper vendre. Rose véritable début tu.
Pendre lors droit relever court fil. Campagne huit portier propos battre secrétaire. Énorme parcourir user patron.",f,t,static/productImg/DAFITI-SHOES-Tênis-DAFITI-SHOES-Lumicolor-Preto-2040-0145382-1-zoom.jpg,"{44,41,46,38,38}","{#60A870,#525E2C}",413.70,44
Ancien,En long amour nu fil grâce oeil autant.,Joli offrir type. Construire effort madame par trait réveiller point. Dessiner sombre prévoir leur pénétrer signifier juger voir.,f,t,static/productImg/DAFITI-SHOES-Bota-DAFITI-SHOES-Fivela-Preta-2292-9376754-1-zoom.jpg,"{46,39,44,37,45,38,46,40,40}","{#ABF32E,#A06CC1,#8DFD07}",380.36,48
Foule,Armée étendre de fier extraordinaire effacer mauvais.,Jeunesse grâce aller obéir quinze salut. Voyage humide franchir bureau examiner aide refuser. Ce général puis angoisse.,f,t,static/productImg/DAFITI-SHOES-Tênis-DAFITI-SHOES-Cetim-Bege-1127-0765413-1-zoom.jpg,"{38,40,37,45,40,46,39,44,40}",{#63BEEC},358.00,17
Souffrir,Commencement cerveau colline venir.,"Fatiguer personne peser comme occasion. Voir si déclarer siècle plein pitié plusieurs.
D'Autres étonner époque prince voie volonté. Étroit désert dix croire pleurer.",f,t,static/productImg/DAFITI-SHOES-Tênis-DAFITI-SHOES-Cetim-Branco-9843-4810123-1-zoom.jpg,"{38,42,41}","{#C3CB08,#EB1654}",57.04,4
Goutte,Lorsque plein marquer naturel.,"Lourd entrer femme relever donner plaine. Savoir caresser son réalité saint million vin.
Chambre chemise taire casser bon matière. Depuis dame fleur élever jamais.",f,t,static/productImg/DAFITI-SHOES-Bota-Coturno-DAFITI-SHOES-Tachas-Preta-5010-6072403-1-zoom.jpg,"{39,37,39,42,45,44,45,36,43}","{#F871BB,#55C12E,#EA3A3B,#EE2940}",290.23,26
Vif,Prochain ci fier chambre oser profond étonner.,Dès mal paysan attitude. Terminer trésor voix rien fortune. Enfermer imaginer eau mourir renoncer rue vieillard.,f,t,static/productImg/DAFITI-SHOES-Tênis-DAFITI-SHOES-Glitter-Preto-3469-8283403-1-zoom.jpg,"{40,41,36,41,36,36,45,39,43}",{#3FD3C0},90.27,24
Beauté,Silence fou cas surveiller flot paupière million.,Exister dos sombre hors. Terre sur bas nombre glisser. Cacher nouveau militaire poussière.,f,t,static/productImg/DAFITI-SHOES-Sandália-DAFITI-SHOES-Adriana-Preta-5048-7748071-1-zoom.jpg,"{46,39,45,46,43,36,45,39,36}","{#AED747,#B26D13,#C5D623,#FF8E14}",100.80,41
Sec,Bas produire choisir résistance de ah consulter.,"Étendre plutôt éclater honneur nouveau. Interrompre oiseau avec l'un billet colline libre lune.
Famille midi vin détail emporter croix. Contenter lire relever payer pied.",f,t,static/productImg/DAFITI-SHOES-Bota-DAFITI-SHOES-Recorte-Caramelo-0309-1456103-1-zoom.jpg,"{42,41,45,41,42}","{#37C73A,#E59BE7}",419.87,11
Plus,Histoire saisir poche avoir voyager imposer commencer.,Étage vif recevoir cheval. Enfoncer sauter mal être agent te beaucoup. Qualité dégager résoudre souvenir travail lumière.,f,t,static/productImg/DAFITI-SHOES-Sapatilha-DAFITI-SHOES-Bordado-Preto-1654-1190523-1-zoom.jpg,"{36,44,41,42}","{#256FF2,#BD3019}",332.78,29
Après,Feuille emmener parole grave chemin.,Long nous jeune été. Défaut beau prière pencher autour conduire. Blanc rire digne. Comme nouveau subir attirer secrétaire quartier.,f,t,static/productImg/DAFITI-SHOES-Tênis-DAFITI-SHOES-Cano-Curto-Preto-3481-5464953-1-zoom.jpg,"{38,36,39,39,38,45,42}","{#A26A5D,#E65252,#8AC84E,#67E794}",364.85,3
Brûler,Pauvre miser vêtement plein joindre retrouver couper ce.,Faux lui distance rare effacer. Champ humain pousser goût plonger calme rencontrer.,f,t,static/productImg/DAFITI-SHOES-Sandália-DAFITI-SHOES-Camurça-Vinho-8049-1740761-1-zoom.jpg,"{44,46,42}","{#D63F01,#9CD8C6,#0D7169}",58.50,6
An,Blanc champ façon.,"De camarade comprendre exister garde poésie. Disparaître chacun douleur.
Plein pencher place étendue acheter. Train haut mensonge savoir au robe venir. Chute aide voisin beau briller.",f,t,static/productImg/DAFITI-SHOES-Bota-DAFITI-SHOES-Fivela-Preta-2292-9376754-1-zoom.jpg,"{38,40,41,39,45,42,40,45,37}","{#9BE873,#42462B,#C465AB}",190.80,19
Poussière,Endormir printemps parcourir cent anglais.,Ton inviter accorder certain. Dehors envoyer parole après trois près. Exister est émotion revoir. Accent branche éteindre.,f,t,static/productImg/DAFITI-SHOES-Rasteira-DAFITI-SHOES-Nó-Preta-6048-3466713-1-zoom.jpg,"{39,37,38,41}","{#5D076D,#A25129,#421904,#4194C5}",147.79,14
Question,Occuper chef sauver agir te.,"Aussitôt apporter lettre vivant. Ministre ah il entier discuter puisque. Garçon homme public vol construire.
Véritable tâche autrefois parent. Sommet violence contenter sûr malheur.",f,t,static/productImg/DAFITI-SHOES-Tênis-DAFITI-SHOES-Glitter-Preto-3469-8283403-1-zoom.jpg,"{45,40,37,46,41,42}","{#C49BA7,#092997,#EEF720}",201.64,4
Coeur,Forme nul chat musique cou conscience.,"Fou naître empêcher horizon coucher chant. Avoir exposer cher diriger.
Fuir l'un éviter tourner intérieur mettre. Oncle y nature ton engager peu étendue.",f,t,static/productImg/DAFITI-SHOES-Bota-DAFITI-SHOES-Verniz-Preto-5691-2117553-1-zoom.jpg,"{36,38}","{#032920,#C29FED,#DFBBBD}",319.09,30
Long,Plaire quel type vieux avec remettre.,Arrêter mériter autre relation mesure chute chaise. Animer cesse après mal lui portier quelque quart. Soutenir précieux autre frais.,f,t,static/productImg/DAFITI-SHOES-Sandália-DAFITI-SHOES-Tiras-Preta-1363-8322634-1-zoom.jpg,{37},"{#8F22E2,#FFAEC1,#04B0BB,#38EC4E}",205.07,14
Second,Trembler journée devoir personne bouche.,Noir témoin coûter quand train souffrir fauteuil. Regretter arracher ennemi bois chemise herbe. Mauvais midi réclamer nourrir avancer.,f,t,static/productImg/DAFITI-SHOES-Sandália-DAFITI-SHOES-Stripes-Lux-Nude-6216-6411732-1-zoom.jpg,{44},"{#D746CE,#EAFBB8}",377.45,48
Renoncer,Page plutôt lien fait faveur.,"Port mouvement vêtement souhaiter. Promener révéler toi militaire. Signifier froid disposer escalier tranquille chaque perdu.
Conversation où résister supporter. Établir déposer devoir condamner.",f,t,static/productImg/DAFITI-SHOES-Tênis-DAFITI-SHOES-Cetim-Branco-9843-4810123-1-zoom.jpg,"{46,41,42,37,44}",{#44A1C2},46.55,13
Choix,Soleil environ couvrir douter baisser but champ.,"Fine courir remarquer immense. Avance ouvrir fort visite.
Jeune accorder impression. Ancien lèvre commun malade ça éternel voyager chasser. Silencieux malade existence clef. Rapport conclure un rose.",f,t,static/productImg/DAFITI-SHOES-Sandália-DAFITI-SHOES-Nude-1839-5081561-1-zoom.jpg,"{36,39,36,41,42}","{#B315D5,#E1232D}",201.32,12
Envelopper,Compagnie existence préférer air vrai lentement.,Semaine cependant paraître phrase en. Prouver saisir éclairer lui jeter. Avenir poser repousser élever muet.,f,t,static/productImg/DAFITI-SHOES-Bota-Flatform-DAFITI-SHOES-Verniz-Rosa-8943-1763103-1-zoom.jpg,{38},{#FA6257},244.04,36
Durant,Mois écarter nous science ancien droite.,Tomber gauche confier beauté patron moyen confier cheveu. Sûr prouver joue. Système lier réflexion en. Rocher visible porter demain chair respirer.,f,t,static/productImg/DAFITI-SHOES-Sandália-DAFITI-SHOES-Tiras-Preta-1363-8322634-1-zoom.jpg,"{41,41,46,39}","{#CF5EFB,#292311,#26F08E,#6ADFDF}",231.25,49
Ainsi,Violent or raconter chambre faim allumer.,Ramener terrible fruit. Carte emmener voici déposer cabinet quitter caresser vaste. Chasse difficile aider passé feu.,f,t,static/productImg/DAFITI-SHOES-Tênis-DAFITI-SHOES-Glitter-Preto-3469-8283403-1-zoom.jpg,"{40,44,41,43,41}","{#55CC54,#B880A3,#57E767}",247.24,19
Calme,Agiter violent subir mari espace établir.,Déjà voyager situation vrai grand vin. Vêtement sentir marché bas surprendre étroit cause chercher.,f,t,static/productImg/DAFITI-SHOES-Tênis-DAFITI-SHOES-Cano-Baixo-Preto-7095-1344632-1-zoom.jpg,"{43,36,39,43,43,42,37,37,36}",{#7C268C},125.86,44
On,Passion rue creuser but large gloire.,"Dégager hésiter mariage présence peser emporter rideau. Avancer exposer pendant vision triste. Dernier avoir siècle reprendre genre important position.
Fin fils maintenant attirer trembler sac.",f,t,static/productImg/DAFITI-SHOES-Tênis-DAFITI-SHOES-Cetim-Bege-1127-0765413-1-zoom.jpg,{44},"{#72F715,#5597B2}",66.11,13
Acheter,Blond où justice visible pousser nourrir auquel pauvre.,Pendant devant relever violent. Journal cinq porter danger effet crainte rêver violence.,f,t,static/productImg/DAFITI-SHOES-Bota-DAFITI-SHOES-Verniz-Preto-5691-2117553-1-zoom.jpg,"{44,38,42,41,38,46,42,44}","{#5CCB86,#D72FB1,#520F47,#52031C}",155.43,10
Répéter,Haine loi fort exécuter mourir achever.,"Nord aide part chercher sentiment nez chaleur. Rire oreille nature après devoir palais ni. Mur billet qui lui chambre caractère épaule.
Apercevoir supérieur éclairer condamner.",f,t,static/productImg/DAFITI-SHOES-Bota-DAFITI-SHOES-Verniz-Preto-5691-2117553-1-zoom.jpg,"{46,39,38,45,36,38,42}","{#BAA250,#990DFF}",112.89,28
Marier,Immense nation paix.,"Est attitude fuir ce reste.
Colère installer second tard. Commun annoncer vague prix tant intéresser déchirer. Morceau prêter exiger en.",f,t,static/productImg/DAFITI-SHOES-Tênis-DAFITI-SHOES-Cano-Baixo-Preto-7095-1344632-1-zoom.jpg,{46},"{#63ED3C,#196651,#5836DB}",84.18,31
Autrefois,Lequel auquel tenter troisième.,"Remercier sueur demain.
Or réfléchir deux reprendre oiseau bord route. Poitrine conclure moindre. Femme fort banc.",f,t,static/productImg/DAFITI-SHOES-Sandália-DAFITI-SHOES-Stripes-Lux-Nude-6216-6411732-1-zoom.jpg,"{43,40,41,42,36,44}","{#3CE764,#C5A4F5}",342.25,8
Résister,Demain te sou inventer journal.,"Figure lorsque après dessus par animer écrire. Point puis poésie poursuivre riche vieux. Fonder barbe douleur. Prêter devant user là creuser début.
Réalité jeune complet partout rien sommet arriver.",f,t,static/productImg/DAFITI-SHOES-Rasteira-DAFITI-SHOES-Veludo-Color-Bege-4256-7856713-1-zoom.jpg,"{38,43,39}","{#F68B78,#D9767E,#340733,#FF87F2}",159.20,26
Vaste,Apporter époque grandir enfance poser proposer.,Mien commencer supposer respect terreur triste. Vous franchir protéger couche grandir. Ajouter que image le.,f,t,static/productImg/DAFITI-SHOES-Bota-DAFITI-SHOES-Corrente-Preta-3484-5771282-1-zoom.jpg,"{41,38,36,37,41,39,37}","{#7272D1,#38C53A}",376.61,28
Départ,Pur demain yeux baisser accomplir durant.,Avant oeil si quelque droit vingt. Rue satisfaire apercevoir maintenir semblable désigner bonheur. Besoin pendre miser emmener désirer croire animal.,f,t,static/productImg/DAFITI-SHOES-Tênis-DAFITI-SHOES-Cetim-Branco-9843-4810123-1-zoom.jpg,"{44,45,40}",{#2851E9},407.58,39
Course,Comprendre discussion importer pouvoir jeune.,"Rôle dehors gens il humain inquiéter. Court jamais perte loi appartenir même.
Succès songer toi. Entraîner lever douter poids premier as.",f,t,static/productImg/DAFITI-SHOES-Tênis-DAFITI-SHOES-Glitter-Preto-1793-2519892-1-zoom.jpg,"{43,45}","{#568F33,#2C8803,#1704E4}",37.51,38
Attention,Classe disposer regretter.,"Conscience objet chaise trembler. Marcher âge choix passé présent.
Attaquer feu paysan obéir. Objet atteindre montrer reculer comment mille. Sept parole machine effet direction valeur.",f,t,static/productImg/DAFITI-SHOES-Tênis-DAFITI-SHOES-Cano-Baixo-Bege-8194-6005632-1-zoom.jpg,"{41,46,36,36,43,41,46,44,38}",{#0F0483},231.11,36
Supporter,Voix résoudre ombre d'abord.,Éprouver nature on soleil presque éprouver an. Porte contraire rester silencieux politique risquer.,f,t,static/productImg/DAFITI-SHOES-Bota-DAFITI-SHOES-Veludo-Marrom-8902-3963103-1-zoom.jpg,{46},"{#0F8EC4,#AAF4E1,#ABBBB2,#416F18}",405.43,5
Perdre,Habitant rond colline demain soleil leur.,"Pourquoi rien position portier ne grandir. Souvenir pied doucement retenir représenter cas.
Répéter fonder faveur éprouver forêt. Calmer fil source général soulever.",f,t,static/productImg/DAFITI-SHOES-Tênis-DAFITI-SHOES-Lumicolor-Preto-2040-0145382-1-zoom.jpg,"{46,44}",{#821B3A},347.19,44
Glace,Cercle préférer vaste croire eau moindre politique sueur.,Chasser intention battre attacher mer montagne changement plante. Certes accord payer exprimer sens. Selon paupière dire mourir.,f,t,static/productImg/DAFITI-SHOES-Sapatilha-DAFITI-SHOES-Recorte-Azul-Marinho-3573-1378673-1-zoom.jpg,{39},"{#11AAD2,#C89FF2,#556D70}",180.50,23
Charger,Renverser ouvert froid éclairer là choisir précis.,"Agiter prendre tour rire condamner. Existence minute projet hasard fauteuil certainement. Nombreux descendre face.
Exécuter présence père cinq flot avenir. Réunir endormir instant.",f,t,static/productImg/DAFITI-SHOES-Oxford-DAFITI-SHOES-Recortes-Rosa-1342-3045183-1-zoom.jpg,"{36,46,36,36,37}","{#BAA1D8,#6E59D0,#24445E}",252.83,0
Accrocher,Non déjà user épaule le humain quelqu'un.,"Terreur parvenir lentement premier penser annoncer empire.
Force défaut signe port appuyer apparaître. Enlever somme loin fin gagner scène.",f,t,static/productImg/DAFITI-SHOES-Bota-DAFITI-SHOES-Verniz-Preto-5691-2117553-1-zoom.jpg,"{37,39,37,46,40,45,42}",{#E012D2},126.04,18
Vous,Vert ah parler fleur.,Autre quartier durer éviter de accomplir. Dresser général vouloir oui faire. Objet blanc intérieur verre dessiner valoir.,f,t,static/productImg/DAFITI-SHOES-Sandália-DAFITI-SHOES-Stripes-Lux-Nude-6216-6411732-1-zoom.jpg,"{36,43}",{#8A1EB6},173.82,4
Inspirer,Terrible doute rencontre atteindre.,Moment regarder reposer gauche puissance exprimer. Car cinq tant temps blanc françois queue.,f,t,static/productImg/DAFITI-SHOES-Scarpin-DAFITI-SHOES-Glitter-Preto-2418-6762103-1-zoom.jpg,"{39,43,38,46,37,39,41}",{#E22BFC},393.37,12
Terreur,Gagner pur court naissance envie rapide toute.,Usage théâtre lorsque souvent magnifique. Protéger pouvoir avancer pensée premier ci gauche retrouver. Amour brûler grand moitié prix.,f,t,static/productImg/DAFITI-SHOES-Bota-DAFITI-SHOES-Textura-Preta-0530-4465703-1-zoom.jpg,"{46,44,36,38}","{#B7C57D,#17F1D6}",117.49,0
Rouge,Aile monde silence crainte dont.,"Ça secret femme consulter. Barbe terreur prétendre bas établir intéresser.
Animal semaine porte société curiosité quartier ensemble as. Dame tombe asseoir.",f,t,static/productImg/DAFITI-SHOES-Tênis-DAFITI-SHOES-Liso-Preto-8271-9244632-1-zoom.jpg,"{36,41,43,44,42,44,43}","{#ACE3B6,#451B2C,#3B5493,#D78AB5}",170.93,25
Sûr,Malade accrocher mesure frais.,"Enfant côté après rapide le. Il veille armer jeune inviter porter raconter.
Être nom défendre cerveau. Problème différent haut charge accepter.",f,t,static/productImg/DAFITI-SHOES-Bota-DAFITI-SHOES-Veludo-Marrom-8902-3963103-1-zoom.jpg,"{46,42,46,42}","{#D67646,#C9F3F5,#352091}",71.81,35
Prison,Coucher pas employer accord.,Clef discours quinze repousser journée race fois parcourir. Etc champ gouvernement question attitude riche elle.,f,t,static/productImg/DAFITI-SHOES-Tênis-DAFITI-SHOES-Glitter-Preto-3469-8283403-1-zoom.jpg,"{38,42,41,38,39,40,41,46}","{#E33E67,#571EE9,#81367D,#45E69D}",338.05,38
Minute,Beaucoup côte contenter cours mieux.,Demain rayon idée entretenir état feu sans. Entretenir vêtir réflexion rocher mal.,f,t,static/productImg/DAFITI-SHOES-Rasteira-DAFITI-SHOES-Nó-Preta-6048-3466713-1-zoom.jpg,"{39,38,46,46,37,41,46}","{#E0B2E6,#B45371}",88.86,22
Drame,Chambre expérience tendre arrêter guère souvenir capable arrêter.,Sentir public fixe. Particulier tapis note allumer claire.,f,t,static/productImg/DAFITI-SHOES-Tênis-DAFITI-SHOES-Cetim-Bege-1127-0765413-1-zoom.jpg,"{39,41,38,42,43,41,36,41}","{#CC80C3,#265420}",78.73,34
Attitude,Loup écraser réflexion point.,"Enfin baisser violent question. Oreille succès perdu avance famille accord oh position.
Fauteuil usage accord personnage hiver. Parfaitement fort rentrer renoncer précis politique miser.",f,t,static/productImg/DAFITI-SHOES-Bota-DAFITI-SHOES-Textura-Preta-0530-4465703-1-zoom.jpg,"{44,45,38}","{#9547E0,#424286}",138.81,30
Confier,Fonction dangereux l'une chef justice.,Place dernier marche retomber parcourir mener. Terminer affaire deux déjà parler leur joie. Public hors peine détruire.,f,t,static/productImg/DAFITI-SHOES-Slip-On-DAFITI-SHOES-Perfuros-Preto-7100-4344632-1-zoom.jpg,"{38,42,36,38,37,46,37,45}","{#5BAAA9,#9745AA,#5A3DF6,#7D323B}",118.65,2
Faim,Témoin expliquer écarter tantôt renverser seuil.,Mur avancer particulier besoin trois accrocher puissance vieux. Bord effacer plan. Porter lire arriver tenter.,f,t,static/productImg/DAFITI-SHOES-Slip-On-DAFITI-SHOES-Perfuros-Preto-7100-4344632-1-zoom.jpg,"{38,45,46,38,43,45,45,37}","{#933FCB,#BDD9A5,#65EC96}",252.35,24
Même,Curieux forêt ajouter nu.,"Revenir cheval animer garde sens.
Rose subir nourrir entendre qualité. Pauvre énergie apercevoir circonstance étendre. Trésor tâche seuil crainte ferme réel.",f,t,static/productImg/DAFITI-SHOES-Slip-On-DAFITI-SHOES-Perfuros-Preto-7100-4344632-1-zoom.jpg,{38},{#C429C9},302.14,15
Apparence,Chant peine succès soleil paysan travers delà.,"Désespoir mal impression en. Moi leur danger.
Immobile hésiter répandre gloire durant obliger. Plaisir tuer hasard d'autres animal robe danser.",f,t,static/productImg/DAFITI-SHOES-Bota-Flatform-DAFITI-SHOES-Verniz-Rosa-8943-1763103-1-zoom.jpg,"{39,46}","{#DE82FE,#C42427}",302.97,27
Répondre,Rouler courage apparence me fine venir celui droit.,Sourire heureux dire encore présent rencontrer veille. Écrire chacun raison car là faire. Type clef course traiter consentir.,f,t,static/productImg/DAFITI-SHOES-Sapatilha-DAFITI-SHOES-Recorte-Azul-Marinho-3573-1378673-1-zoom.jpg,"{45,46,41,44,45,44,40,38}","{#B0FD87,#C6278C,#F57A12}",35.65,26
Être,Égal dominer peser goutte.,Nommer français partie. Société habiller dès. Nez auquel bas créer mari. Désespoir ensuite apparence en peur ensuite.,f,t,static/productImg/DAFITI-SHOES-Tênis-DAFITI-SHOES-Cetim-Bege-1127-0765413-1-zoom.jpg,"{42,40,45,37,39,45,41,46}","{#B07C7A,#228C03,#AC8255,#0496D0}",117.85,49
Reposer,Histoire oh arbre presque.,Rêver figurer armée entourer ceci si mourir. Huit tout occuper six ruine obliger prison.,f,t,static/productImg/DAFITI-SHOES-Tênis-DAFITI-SHOES-Pesponto-Bege-9133-4991692-1-zoom.jpg,"{38,41,39,37,36,41,43,44}",{#107FD7},266.64,17
Étude,Peine voir chemise quelque image robe juste.,"Pensée mari certain trait.
Madame vague bureau succès vide. Plus promener face précis semblable. Tellement cours poids. Et occuper intérieur déposer.",f,t,static/productImg/DAFITI-SHOES-Bota-Coturno-DAFITI-SHOES-Tachas-Preta-5010-6072403-1-zoom.jpg,"{45,36,39,36,39,42,36,46,44}","{#8B5785,#664495,#744676}",208.58,13
