brand,title,description,featured,active,image,sizes,colors,cost,profit
Souffrir,Salle cours masse répéter.,"Devoir soudain problème triste brûler avant. Supposer ci faux imposer.
Neuf gros obtenir gouvernement. Reposer doucement geste. Découvrir rapide grave dont gris éclater exposer.",f,t,static/productImg/DAFITI-SHOES-Tênis-DAFITI-SHOES-Glitter-Preto-1793-2519892-1-zoom.jpg,"{43,38,41,43,44}","{#C23430,#82E29A,#457308,#4F8F4E}",326.73,9
Dans,Retrouver demande oeuvre autre puis route présent.,"Angoisse accrocher permettre professeur vite parcourir.
Attendre compter chercher. Bras manquer position précis.
Escalier douter bande vrai couper ministre certes. Perdu voisin tête oui long.",f,t,static/productImg/DAFITI-SHOES-Tênis-DAFITI-SHOES-Cano-Baixo-Preto-7095-1344632-1-zoom.jpg,"{41,44,46}","{#F768BC,#166C47,#E5818C,#1D1D1B}",240.19,46
Étonner,Parti éloigner désirer erreur faux continuer d'autres.,Crainte lien juge moi coeur chair apparaître. Étendue éclat saint. Juger raison détruire perte hésiter ami.,f,t,static/productImg/DAFITI-SHOES-Bota-DAFITI-SHOES-Corrente-Preta-3484-5771282-1-zoom.jpg,"{39,40,40,37,38}",{#051BB8},64.29,29
Parmi,Terrain paupière déjà poésie recherche chaud comme.,Malade représenter convenir différent sueur force contraire. Heure air sortir fort goût nommer. Tour mouvement claire éclairer preuve ligne.,f,t,static/productImg/DAFITI-SHOES-Rasteira-DAFITI-SHOES-Strass-Preta-9509-3590433-1-zoom.jpg,{44},"{#2E405E,#5FF0D4}",96.41,31
Vide,Présent ensuite tu intéresser.,"Problème accrocher espèce reprendre. Présent prier prêter trésor.
Accrocher drôle selon réflexion pain confondre. Faim anglais avis condition accorder produire humain.",f,t,static/productImg/DAFITI-SHOES-Rasteira-DAFITI-SHOES-Nó-Preta-6048-3466713-1-zoom.jpg,"{44,41,46}","{#9C2F75,#BA966F}",430.67,30
Savoir,Lors or état menacer partager tenter sauter.,"Nécessaire fier expérience or. Chaud accepter oiseau endroit. Cabinet personne cri honte soldat auquel.
Posséder action après auquel intérieur faire.",f,t,static/productImg/DAFITI-SHOES-Tênis-DAFITI-SHOES-Glitter-Preto-1793-2519892-1-zoom.jpg,"{44,45,36,44,41}","{#F4F7F8,#FFF336,#6762CB,#AD1F67}",125.28,42
Affirmer,Champ reculer roman dessiner.,"Immobile livrer vague. Français tôt pleurer éclairer seulement froid sans beau. Fond te côté agent.
Cercle mode reconnaître pointe fou rouge. Tout terre écarter matière.",f,t,static/productImg/DAFITI-SHOES-Sandália-DAFITI-SHOES-Meia-Pata-Salto-Grosso-Preta-5696-9926962-1-zoom.jpg,"{43,41,43,40,37}","{#6C8D04,#70521A}",371.12,4
Classe,Tranquille intérêt image habiter classe plan trop pierre.,"Droit aucun court riche perdu pleurer poids. Puis habitant doigt pencher rien grand respect. Froid observer ordre poser mourir compagnie prochain.
Éteindre forme cinquante. Réunir tourner souvenir.",f,t,static/productImg/DAFITI-SHOES-Tênis-DAFITI-SHOES-Glitter-Preto-1793-2519892-1-zoom.jpg,"{43,39,37,46,42,46,45,41,46}","{#56E512,#A34C17}",53.24,1
Dangereux,Ennemi supporter passer extraordinaire espace battre.,Déchirer reculer accent animer éviter coeur agir époque. Chose riche type résoudre rapporter.,f,t,static/productImg/DAFITI-SHOES-Bota-Coturno-DAFITI-SHOES-Tachas-Preta-5010-6072403-1-zoom.jpg,"{43,36,42,39}","{#EB19FA,#45D1E4,#7898D1}",403.58,20
Seul,Société queue étranger.,Absolument fauteuil objet eaux corps queue. Sommet nerveux noir souffrance cas secours.,f,t,static/productImg/DAFITI-SHOES-Rasteira-DAFITI-SHOES-Veludo-Color-Bege-4256-7856713-1-zoom.jpg,"{38,37,45,42,36}",{#CD38E2},272.62,10
Nu,Envie beaucoup autre brûler plaine tard.,"Importer bruit vent entre. Arrière cacher magnifique tantôt amour éternel autorité. Douleur grave musique geste crise nouveau.
Trou nuit personne militaire mieux.",f,t,static/productImg/DAFITI-SHOES-Bota-DAFITI-SHOES-Veludo-Marrom-8902-3963103-1-zoom.jpg,"{42,39}",{#1BB76D},172.90,33
Longtemps,Condition crier gauche fuir désert énergie secrétaire.,En carte verre reprendre examiner intéresser consulter. Partout matin différent race marier précieux. Rond poésie siècle. Yeux armée noire femme respecter gouvernement soir.,f,t,static/productImg/DAFITI-SHOES-Bota-DAFITI-SHOES-Textura-Preta-0530-4465703-1-zoom.jpg,"{43,38,46}","{#B291F6,#F87BD6,#B9CF1B}",405.55,16
Contre,Traîner disposer agent pouvoir vêtir fruit.,Maître français disparaître. Tuer déchirer votre. Lui secrétaire seul ailleurs mener premier.,f,t,static/productImg/DAFITI-SHOES-Bota-Coturno-DAFITI-SHOES-Tachas-Preta-5010-6072403-1-zoom.jpg,"{37,38,37,44,42}","{#80B7F7,#5E20DA,#D8B71E,#FA6762}",91.80,15
Avouer,Prier ennemi dernier souvenir.,Siècle as clair paquet suite terre essuyer. Mort confier subir exécuter rêver. Témoin refuser accuser bande là peu.,f,t,static/productImg/DAFITI-SHOES-Slip-On-DAFITI-SHOES-Perfuros-Preto-7100-4344632-1-zoom.jpg,"{39,40,46,38,36}","{#B574EA,#81D7AB,#3FBF06,#53B206}",134.47,41
Presser,Pas ci maladie elle protéger juste.,Reprendre dur rare gris important nez. Suivre petit doute suffire problème. Céder interrompre position toile nu dent haut.,f,t,static/productImg/DAFITI-SHOES-Tênis-DAFITI-SHOES-Cano-Baixo-Preto-7095-1344632-1-zoom.jpg,"{43,46,41,45,43,46}",{#0FEE00},83.96,2
Or,Asseoir calme soumettre sûr commencement plonger être signer.,Raison long parole pareil nuit briller. Parcourir sourire fois fin. Bouche musique pendant croix attaquer article.,f,t,static/productImg/DAFITI-SHOES-Sandália-DAFITI-SHOES-Nude-1839-5081561-1-zoom.jpg,"{40,38,39,45,37}","{#B25BF8,#05BDFA}",55.60,30
Prétendre,Huit espérer devoir réalité endormir.,Beau soldat davantage absolu désir. Quand obliger volonté détruire théâtre plaindre. Éclat tendre million masse devoir.,f,t,static/productImg/DAFITI-SHOES-Tênis-DAFITI-SHOES-Lumicolor-Preto-2040-0145382-1-zoom.jpg,"{39,46}","{#AB685C,#CC4572}",139.28,38
Gens,Droit paysage cabinet chanter trouver jeune.,"Mêler neuf nu blond million bon endormir.
Rocher fixe surtout commencer. Casser prendre bas oh. Genre l'une abandonner arme étouffer étendre.",f,t,static/productImg/DAFITI-SHOES-Sapatilha-DAFITI-SHOES-Bordado-Preto-1654-1190523-1-zoom.jpg,"{40,36,38,39,46,45}",{#7F2786},430.21,39
Prétendre,Reconnaître moi jeune.,Ton angoisse instinct lui puisque reconnaître. Boire tomber leur entier droite recommencer.,f,t,static/productImg/DAFITI-SHOES-Tênis-DAFITI-SHOES-Lumicolor-Preto-2040-0145382-1-zoom.jpg,"{40,36,39}",{#C872DB},327.95,27
Quant À,Tracer valeur plaine pauvre quelque autrement cesse couvrir.,Rêver aider malade réduire puisque drôle. Intéresser livre lever quatre lisser parce que.,f,t,static/productImg/DAFITI-SHOES-Bota-DAFITI-SHOES-Textura-Preta-0530-4465703-1-zoom.jpg,"{39,45,36}","{#8BEA20,#1DD73D}",165.24,37
Carte,Votre minute marier accompagner mince.,"Pont portier dans même importance accorder. Hors choix mari anglais vent bas aller choix.
Passé point mener tellement. Battre yeux fatiguer. Or lieu poche livrer comment soi.",f,t,static/productImg/DAFITI-SHOES-Sandália-DAFITI-SHOES-Stripes-Lux-Nude-6216-6411732-1-zoom.jpg,"{44,39,41,41,38,39,45,46}","{#D19BD0,#07C977,#0960E8,#22D431}",206.69,28
Curieux,Maison français sien puis scène.,Allumer précéder rester double représenter visible pouvoir donc. Bleu plein empire déjà. Bas vieux charge ici simple dire chasser quinze.,f,t,static/productImg/DAFITI-SHOES-Bota-DAFITI-SHOES-Textura-Preta-0530-4465703-1-zoom.jpg,"{44,38,40,39}",{#A072F0},37.01,38
Soleil,Rideau retour accomplir accent poursuivre fuir.,Soumettre train profiter. Armée un nouveau drame. Comment quarante ennemi étendre. Absolu respirer arme tant épais rond travail.,f,t,static/productImg/DAFITI-SHOES-Bota-DAFITI-SHOES-Recorte-Caramelo-0309-1456103-1-zoom.jpg,"{37,38,38}","{#3D6FFA,#C617EB,#9494A3,#55E123}",326.82,17
Hésiter,Bout revoir adresser rapidement avance.,"Le certain matin exécuter dimanche hors. Fou courage regretter. Y d'autres diriger époque devant approcher.
Règle offrir voie distance veiller.",f,t,static/productImg/DAFITI-SHOES-Sandália-DAFITI-SHOES-Tiras-Preta-1363-8322634-1-zoom.jpg,"{43,42,44,40,44,37}","{#CBAA2C,#DC43CD,#D26B74}",72.26,3